{
  "summary": {
    "title": "Reasoning Graph",
    "answer": ""
  },
  "nodes": [
    {
      "id": "G1",
      "type": "goal",
      "text": "Solve the problem"
    }
  ],
  "edges": [],
  "frontier": [],
  "search_policy": {
    "estimated_remaining_weight": 1.0
  },
  "stop_policy": {
    "belief_threshold": 0.8,
    "severity": "error"
  }
}
