{
  "summary": {
    "title": "Factor state",
    "answer": "Grouped evidence supports A1."
  },
  "nodes": [
    {
      "id": "G1",
      "type": "goal",
      "text": "Find exact cause"
    },
    {
      "id": "E1",
      "type": "evidence",
      "text": "Primary signal appears",
      "confidence": 0.9
    },
    {
      "id": "E2",
      "type": "evidence",
      "text": "Secondary signal appears",
      "confidence": 0.8
    },
    {
      "id": "A1",
      "type": "assumption",
      "text": "Cause is grouped signal",
      "prior": 0.4
    },
    {
      "id": "CS1",
      "type": "candidate_solution",
      "text": "Grouped signal is the cause",
      "answer_kind": "exact_answer"
    }
  ],
  "edges": [
    {
      "id": "E1A1",
      "from": "E1",
      "to": "A1",
      "type": "supports"
    },
    {
      "id": "E2A1",
      "from": "E2",
      "to": "A1",
      "type": "supports"
    },
    {
      "id": "A1CS1",
      "from": "A1",
      "to": "CS1",
      "type": "leads_to"
    },
    {
      "id": "CS1G1",
      "from": "CS1",
      "to": "G1",
      "type": "answers"
    }
  ],
  "factors": [
    {
      "id": "F_SUPPORTS_A1",
      "relation": "supports",
      "target": "A1",
      "inputs": [
        "E1",
        "E2"
      ],
      "aggregation": {
        "kind": "likelihood",
        "if_target_true": 0.8,
        "if_target_false": 0.2
      },
      "reason": "Signals share one detector and should be grouped as correlated support."
    }
  ],
  "frontier": [
    {
      "id": "Q1",
      "node": "A1",
      "cost_components": {
        "truth": "auto",
        "verification": 0.2
      }
    }
  ]
}
